School,Name,URL,DESCRIPTION,Subject
NCCU,W.D. Hill Recreation Center,https://nccu.galaxydigital.com/agency/detail/?agency_id=80449,"W.D. Hill Recreation Center is part of the City of Durham Parks and Recreation Department. They provide recreational programs to people of all ages in Durham through an after school program, a senior lunch program, and many other programs.",Athletics
Duke,ArtsConnect,https://dukegroups.com/artsconnect/home/,"ArtsConnect strives to show students, using art as a gateway, that creativity is both a desirable and useful trait in today’s world. In an academic environment that often includes limited engagement with arts programs, the club hopes to provide a form of immersion and engagement in the arts for children at a young age.",Art
Duke,Audacity Labs,N/A,"Audacity Labs is a curriculum provider, startup incubator and co-working space for teens. The club empowers local 9th-12th grade students with the tools and resources to effectively develop a start-up. The program enables participants to zoom in on a specific customer need, develop a new product or service, and eventually launch a sustained enterprise. In doing so, students develop key skills associated with the start-up process, including problem-solving, creativity, computational thinking, and collaboration. To support them in this endeavor, members are empowered by workshops, mentors, virtual reality excursions, academic support, and counseling.",Entrepeneurship
Duke,Bull City Scholars,https://dukegroups.com/bullcity/home/,"Bull City Scholars creates a sustainable mentorship and tutoring program focused on college access for Durham middle school students that are currently not served by Duke’s Partnerships for Service. In order to support an informed model of service, students may participate in an optional, introductory house course investigating education inequality and pedagogy.",Academics
Duke ,Camp Kesem,N/A,"Camp Kesem is a weeklong, sleep-away camp for children aged 6-18 whose parent or guardian has (or have had) cancer. It is free for the campers and is designed to provide a week of support and community for Camp Kesem campers. In addition to camp, we offer support to families throughout the year in the form of birthday and anniversary cards, virtual meetings, one in-person event for camper families each semester, and connection to resources. The Kesem chapter at Duke University, is one of the largest of 137 chapters nationwide committed to serving children affected by a parent’s cancer diagnosis.",Camp
Duke,Duke Best Buddies,https://www.bestbuddies.org/,Best Buddies hosts events that seek to build meaningful relationships between Duke students and individuals with intellectual and developmental disabilities in the Durham area and by having awareness events that raise awareness and inclusion for the disability community.,Friendship
Duke,Duke bioSTEMs,N/A,"bioSTEM promotes academic, collegiate, and professional success in high schoolers with a focus on the life sciences. bioSTEMs builds mentor-student relationships and provides a broad overview of life science areas to inspire or deepen interest in a field that students haven’t experienced.",STEM
Duke,Duke Innoworks,https://dukegroups.com/innoworksduke/home/,"Duke Innoworks organizes STEM camps for middle school students from the Durham area, fostering curiosity, learning, and growth for the next generation of science leaders.",STEM
Duke,FEMMES,https://sites.duke.edu/femmes/,"Existing disparities in the STEM (science, technology, engineering, and math) fields underscore the need for outreach programs to help engage young students in such areas. Started in 2006 , FEMMES+ (Females and Allies Excelling More in Math, Engineering and Science) is a student-led organization at Duke University that hosts educational outreach programs related to math, science, and engineering for 4th-12th grade students in the Triangle area. FEMMES+ seeks to improve diverse student participation in STEM subjects with various programming including: an annual one-day Capstone event, an After-School program, a Saturday program, a hackathon for high school students, a mentorship program, and a summer camp program.",STEM
Duke,KIDZ VOTE,https://dukegroups.com/kidzvote/home/,"Kidz Vote's mission is to create educational content for Durham schools to educate students about voting rights and the history of voter suppression in Durham, as well as to educate them on voting rights around the world.",Community
Duke,The Girls Club,https://dukegroups.com/tgc/home/,"The mission of TGC is to empower middle school girls attending Durham Public Schools. TGC seeks to accomplish this mission by building a community of mutual trust and respect through weekly meetings between mentees and mentors (Duke undergraduate women) at the Emily K Center, enrichment events in the Durham community, and annual field trips.",Community