STOP_NAME,STOP_ID,LATITUDE,LONGITUDE,SHARED_ROUTES,SHELTERED,SIDEWALK
Roxboro St at Charles St,5575,35.966886,-78.916428,7,0,NA
Fayetteville St at Simmons St,5578,35.982258,-78.899053,"5, 5K",0,NA
North Pointe Dr at North Pointe Shopping Center (WB),5579,36.028632,-78.920304,"1, 1A",1,1
Fayetteville St at Burlington Ave (SB),5580,35.968923,-78.902649,"5, 5K",0,1
E Club Blvd at Lindbergh St,5581,36.022849,-78.878892,"9, 9A, 9B",0,NA
Angier Ave at East End Ave,5582,35.97445,-78.86823,"2, 2A",0,NA
Hardee St at Fiske St,5584,35.998797,-78.864541,"2B, 3, 23",0,NA
Hillandale Rd at Croasdaile Crossing,5590,36.031655,-78.935952,"1, 1A",1,1
Roxboro St at Apt 2519,5591,35.96605,-78.91755,7,0,NA
Lednum St at Murray Ave,5593,36.0272093,-78.909612,"1, 1A",0,NA
Hillsborough Rd at Trent Dr (WB),5594,36.012039,-78.930439,11,0,NA
Duke St at Markham Ave,5595,36.009649,-78.905438,"1, 1A, 1B",0,NA
Foushee St at Avondale Dr (EB),5596,36.016151,-78.887701,"9, 9A, 9B",0,NA
Fayetteville Rd at Geneva Dr (SB),5598,35.920992,-78.928701,"5, 805",0,NA
Riddle Rd at Fayetteville Rd,5599,35.9498287,-78.902913,"12, 12B",0,NA
Carver St at Commons Blvd (WB),5600,36.041499,-78.894746,"9, 9A",1,1
Cornwallis Rd at Industry Ln,5601,35.94278,-78.89973,"12, 12B",0,NA
E Main St at Goley St (WB),5602,35.986111,-78.884607,"2, 2A, 2B",0,NA
Hardee St at Landon St (NB),5603,35.999635,-78.865018,3,1,0
Crest St at Zelko Ct,5604,36.01276,-78.941013,6,0,NA
Pacific Ave at Roxboro Rd,5606,36.046075,-78.901628,9B,0,NA
Erwin Rd at Trent Dr (EB),5607,36.007683,-78.933199,BCC,0,1
Hyde Park Ave at E Main St (Trosa Inc.),5608,35.984603,-78.881685,"2, 2A, 2B",0,NA
Chapel Hill St at Gregson St (EB),5612,35.996873,-78.911517,"6, 6B",0,1
University Dr at Old Chapel Hill Rd (WB),5613,35.9673517,-78.947182,"10, 10A, 10B",0,NA
Gary St at Liberty St (SB),5615,35.990937,-78.870593,"2B, 23",0,NA
Cornwallis Rd at Yorktown Ave (SB),5616,35.936476,-78.893543,"12, 12B",0,1
Holloway St at Joyland Ave,5618,35.98938,-78.855086,"3B, 3C, 23",0,NA
Front St at Hillandale Rd (Courtyard Marriott),5621,36.030296,-78.937173,1,1,1
Glenbrook Dr at Club Blvd (NB),5622,36.02425,-78.87708,"9, 9A, 9B",0,NA
Sparger Rd at Hillsborough Rd,5625,36.03212,-78.9816,"6B, 11",0,NA
New Castle Rd at FoxFire Apartments (SB),5626,36.05002,-78.9232,9A,0,NA
Holloway St at Spruce St,5627,35.994405,-78.880198,"3, 3B, 3C",0,NA
Hinson Dr at Glenbrook Dr (SB),5630,36.02845,-78.87915,"9, 9A, 9B",0,NA
Green St at Lancaster St (EB),5632,36.011461,-78.913544,11,0,1
Fayetteville Rd at Sutton Station,5633,35.919207,-78.93007,"5, 805",0,NA
Roxboro Rd at St Paul St,5634,36.01758,-78.89008,4,0,NA
Angier Ave at Clay St (EB),5635,35.982831,-78.880138,"2, 2A, 2B",0,NA
Main St at Gregson St (EB),5637,35.999831,-78.909079,BCC,0,1
Main St at Morgan St (EB),5639,36.000859,-78.910686,"11, BCC",0,1
Guess Rd at Lombard Ave,5642,36.03542,-78.929409,"1, 1B",0,NA
Club Blvd at Midland Terrace,5645,36.027057,-78.870507,"9, 9A, 9B",0,NA
Roxboro Rd at Davison Ave (SB),5646,36.018651,-78.890106,4,0,NA
Angier Ave at Bingham St (WB),5647,35.9794268,-78.872118,"2, 2A",0,NA
LaSalle St at Campus Walk Ave (Belmont Apts),5648,36.0100523,-78.948501,11,0,NA
Tower Blvd at Durham-Chapel Hill Blvd (McDonalds),5649,35.970438,-78.958133,10B,0,NA
Durham Chapel Hill Blvd at Fosters,5650,35.974231,-78.931046,"10, 10A",0,NA
Fayetteville Rd at Riddle Rd (NB),5653,35.94915,-78.90373,"5, 5K, 7, 12, 12B",0,NA
Horton Rd at Roxboro Rd,5654,36.051043,-78.904403,"4, 9, 9A",1,0
Chapel Hill St at Kent St (WB),5657,35.99675,-78.91785,"6, 6B",0,NA
Durham Chapel Hill Blvd at James St,5658,35.974825,-78.926443,"10, 10A",0,NA
Pickett Rd at Structure House Dr,5659,35.97465,-78.96238,10B,0,NA
Holloway St at N Driver St (EB),5661,35.994382,-78.878173,"3, 3B, 3C",0,NA
Roxboro Rd at Lavender Ave,5662,36.023384,-78.889811,4,0,NA
New Hope Commons,5663,35.954424,-78.996621,"10, 10A",1,0
Dearborn Dr at Thelma St (north),5664,36.03753,-78.87295,"9, 9A, 9B",0,NA
E Main St at Elm St (WB),5665,35.988531,-78.88932,"2, 2A, 2B",0,1
Holloway St at Elm St (WB),5671,35.994577,-78.887442,"3, 3B, 3C",0,NA
Fayetteville St at Timothy Ave (SB),5672,35.956916,-78.908791,"5, 5K, 7",0,NA
University Dr at Springfield Apts,5674,35.958283,-78.966036,"10, 10A",0,NA
Otis St at Alton St,5675,35.970754,-78.908293,7,0,NA
Broad St at Guess Rd,5677,36.023722,-78.918491,1A,0,NA
Morehead Ave at Cornell St,5678,35.99181,-78.919109,"10, 10A, 10B",0,1
Crutchfield St at Crabtree Ave,5679,36.03892,-78.90312,"4, 9, 9A",0,NA
Hillsborough Rd at Ample Storage,5682,36.033748,-78.970623,11,0,NA
W Club Blvd at Clarendon St,5684,36.017035,-78.918244,"1, 1A, 1B",0,NA
Fayetteville Rd at Cook Rd (NB),5686,35.928882,-78.9199,5,0,NA
S Roxboro St at Umstead St (NB),5689,35.982516,-78.903207,"7, 8",1,1
NC 54 at NC 55 (EB),5690,35.90229,-78.895006,"12, 12B, 800, 805, RTP OD",0,1
Bedford St at Balmoray Ct,5693,35.976893,-78.928676,"10, 10A",1,0
Hillandale Rd at Fawn Ave (Croasdaile Office Park),5695,36.033816,-78.935869,"1, 1A",0,NA
Roxboro St at Summit St,5700,35.971234,-78.915069,7,0,NA
Fayetteville St at Price Ave,5701,35.97997,-78.89975,"5, 5K",0,NA
Roxboro Rd at E Knox St,5702,36.0128198,-78.890896,4,0,NA
Guess Rd at Carver St,5703,36.03712,-78.92958,"1, 1B",0,NA
Guess Rd at Duke Homestead Rd (NB),5704,36.031931,-78.928742,"1, 1A, 1B",0,NA
Roxboro St at Masondale Ave,5706,35.975603,-78.908421,7,0,NA
Angier Ave at Hoover Rd (WB),5708,35.977963,-78.870444,"2, 2A",1,0
Roxboro Rd at Markham Ave,5709,36.01043,-78.89173,4,0,NA
Angier Ave at Carter Ave,5710,35.96833,-78.8606,"2, 2A",0,NA
N Alston Ave at Lee St (NB),5711,36.002009,-78.885772,"9, 9A, 9B",0,NA
Rummel St at Walton St,5713,35.98585,-78.84565,"3C, 23",0,NA
Morreene Rd at Sherwood Dr (NB),5714,36.007155,-78.954687,"6, 6B, D LL",0,NA
Hillsborough Rd at Hicks St,5716,36.01312,-78.93185,11,0,NA
Hillsborough Rd at Frazee Carpet,5717,36.0162,-78.93737,11,0,NA
LaSalle St at Campus Walk Dr (Holly Hill Apts),5718,36.010006,-78.94864,"11, D LL",1,0
Roxboro St at W Knox St,5719,36.012825,-78.891059,4,0,NA
Junction Rd at NC 98,5720,35.99053,-78.8579,"3B, 23",0,NA
Chapel Hill Rd at Vineyard St,5721,35.97795,-78.93567,"10, 10A, 10B",0,NA
Carver St at Danube Ln (Carver Creek Apts),5722,36.044844,-78.890487,9B,1,1
Page Rd at Angier Ave,5724,35.938013,-78.822425,"2, 2A",0,NA
Broad St at Sprunt Ave (NB),5727,36.02054,-78.918845,"1, 1A, 1B",0,NA
Fayetteville Rd at United Dr,5728,35.93697,-78.9079,5,0,NA
Chapel Hill Rd at Crosswind Ave (Lakewood YMCA),5730,35.984934,-78.929065,"10, 10A, 10B",0,NA
Hillsborough Rd at Carolina Ave,5732,36.010538,-78.925131,11,0,NA
Lawson St at Wabash St (WB),5733,35.973842,-78.888908,8,0,NA
Hillsborough Rd at Rutherford St,5734,36.01047,-78.92755,11,0,NA
Holloway St at S Woodcrest St,5735,35.988399,-78.850757,"3B, 3C, 23",1,0
Lawson St at Alston Ave (EB),5738,35.975412,-78.894269,8,1,1
Chandler Rd at Chance Dr,5740,35.99492,-78.83363,"3B, 23",0,NA
E Main St at Roxboro St (WB),5741,35.993961,-78.898635,"2, BCC",1,1
Mangum St at Parrish St,5742,35.995829,-78.900135,"9, 9A, 9B",1,1
Trent Dr at Duke Hospital South (EB),5743,36.00456,-78.935073,"6, 6B, 20, DRX, D H2, D H5",1,1
Holloway St at Brye St,5744,35.993267,-78.871888,"3, 3B, 3C",0,NA
Roxboro St at Normandy St,5746,35.973566,-78.912206,7,0,NA
E Weaver St at Pilot St,5749,35.967722,-78.910178,7,0,NA
Chapel Hill Rd at Lakewood Ave (Shopping Center),5754,35.98692,-78.927131,"10, 10A, 10B",1,1
Lakewood Ave at S Mangum St (EB),5756,35.9875919,-78.905069,"5, 5K",1,1
Dearborn Dr at Forrester St,5764,36.0377,-78.87483,"9, 9A, 9B",0,NA
Hillsborough Rd at Rosehill Ave,5765,36.010649,-78.927815,11,0,NA
NC 55 at Cherry Dr,5767,35.9604,-78.89348,"12, 12B",0,NA
NC 55 at Gaston Ave,5768,35.9625229,-78.894307,"12, 12B",0,NA
Lawson St at Wabash St (EB),5769,35.973878,-78.889521,8,0,NA
LaSalle St at Hillsborough Rd (Tire King),5770,36.0176826,-78.945628,"11, D LL",0,NA
Lawson St at Durham Tech Community College (WB),5773,35.974402,-78.880704,8,1,1
Durham Station,5774,35.995954,-78.906005,"1, 1A, 1B, 2, 2A, 2B, 3, 3B, 3C, 3T, 4, 5, 5K, 6, 6B, 7, 8, 9, 9A, 9B, 10, 10A, 10B, 11, 12, 12B, 15, 400, 405, 700, DRX, NHS, ODX",1,1
Duke University Rd at Swift Ave (EB),5775,35.997076,-78.924248,"6, 6B",0,NA
NC 54 at Paradigm Park,5776,35.901136,-78.891803,"12, 12B, 800, 805, RTP OD",0,NA
Hillsborough Rd at Lawndale Ave (WB),5778,36.014786,-78.933818,11,0,1
Capps St at Athens St (WB),5779,35.963386,-78.885637,8,0,0
E Main St at Driver St (EB),5780,35.9858023,-78.877705,"2B, 23",0,NA
W Enterprise St at Fargo St,5781,35.98373,-78.90752,7,0,NA
Woodcroft Pkwy at Autumn Woods Dr,5782,35.92379,-78.944203,"14, 805",0,NA
Buchanan Blvd at Gloria Ave (SB),5785,36.003663,-78.912544,11,0,1
LaSalle St at Hillsborough Rd (NB),5786,36.0179747,-78.94547,"11, D LL",0,NA
Roxboro Rd at Argonne Dr (SB),5787,36.062833,-78.90424,"9, 9B",0,NA
Rummel St at Wedgedale Ave,5790,35.98623,-78.84737,"3C, 23",0,NA
Lawson St at Rosewood St,5792,35.9750129,-78.891944,8,0,NA
Fayetteville Rd at Crooked Creek Pkwy,5793,35.912022,-78.933837,"5, 14, 0805",0,1
N Alston Ave at Lee St (SB),5794,36.002141,-78.88599,"9, 9A, 9B",0,NA
Hinson St at DeMille St,5795,36.02937,-78.8786,"9, 9A, 9B",0,NA
Mineral Springs Rd at Sapphire St,5797,35.98772,-78.81872,"3B, 23",0,NA
Durham-Chapel Hill Blvd at Garrett Rd,5798,35.961312,-78.977905,"10, 10A",0,0
Roxboro Rd at Fairfield Rd (North Duke Crossing),5800,36.047605,-78.903298,"4, 9, 9A, 9B",0,NA
Broad St at Markham Ave (SB),5801,36.010453,-78.919662,11,0,NA
Broad St at F St (NB),5802,36.01887,-78.91898,"1, 1A, 1B",0,1
Milton Rd at Fire Department,5803,36.088965,-78.913505,9B,0,NA
US 70 at Angier Ave,5804,35.941671,-78.824036,"2, 2A",0,NA
Fayetteville St at Red Oak Ave (SB),5805,35.96677,-78.904576,"5, 5K",0,1
Murray Ave at Broad St,5806,36.02912,-78.91203,"1, 1A",0,NA
Hillsborough Rd at Self Storage,5809,36.03357,-78.97142,"6B, 11",0,NA
Service Rd at Davidson Ave (SB),5811,36.01797,-78.88757,"9, 9A, 9B",0,1
Fayetteville St at Dunstan St,5816,35.978925,-78.900163,"5, 5K",0,1
Holloway St at Hoover Rd,5818,35.990265,-78.858925,"3B, 3C, 23",0,NA
E Main St at Dillard St (Oldham Towers),5819,35.9918921,-78.895096,"2, 2A, 2B, BCC",1,1
Cornwallis Rd at Century Oaks (SB),5820,35.94093,-78.89815,"12, 12B",0,NA
Holloway St at Briggs Ave,5821,35.99377,-78.87362,"3, 3B, 3C",0,NA
NC 55 at NC 54 (NB),5822,35.9029881,-78.895181,"12, 12B, RTP OD",1,1
University Dr at Academy Rd,5823,35.96737,-78.94497,"10, 10A, 10B",0,NA
Lawson St at Concord St (EB),5824,35.976343,-78.903071,"7, 8",1,1
Roxboro Rd at Ellerbee St (SB),5826,36.021653,-78.89006,4,0,NA
Angier Ave at Hoover Rd (EB),5827,35.978289,-78.870944,"2, 2A",0,0
Fayetteville St at Pilot St (SB),5829,35.963923,-78.90724,"5, 5K",1,1
Dearborn Dr at Apollo St,5832,36.03681,-78.869716,"9, 9A, 9B",0,NA
Dearborn Dr at Lakeview School,5833,36.038217,-78.877666,"9, 9A, 9B",0,NA
Dearborn Dr at Maplewood Dr (south),5836,36.033188,-78.869395,"9, 9A, 9B",0,NA
Roxboro Rd at Infinity Rd,5837,36.07848,-78.91027,9B,0,NA
Cornwallis Rd at Jan Ct,5838,35.960445,-78.912622,7,0,1
Fayetteville St at Cornwallis Rd (SB),5841,35.960367,-78.910426,"5, 5K",0,1
University Dt at Dixon Rd,5842,35.967879,-78.940767,"10, 10A, 10B",0,NA
Concord St at Otis St,5843,35.975553,-78.902811,7,0,NA
Hillandale Rd at Carver St (Durham Public Schools),5845,36.035777,-78.935801,"1, 1A",0,NA
Chapel Hill Rd at Vineyard St,5846,35.97798,-78.93575,"10, 10A, 10B",0,NA
Pickett Rd at Coachmans Way,5847,35.97525,-78.96407,10B,0,NA
Flowers Dr at Duke Gardens (SB),5848,36.0011576,-78.936439,"6, 6B, 20",0,NA
Dearborn Dr at Thelma St,5849,36.037318,-78.872481,"9, 9A, 9B",0,NA
Glenbrook Dr at Dubonnet Pl (SB),5850,36.0260874,-78.876979,"9, 9A, 9B",0,NA
Lawson St at Ridgeway Ave,5851,35.973947,-78.887482,8,0,NA
Fayetteville Rd at Dunhill Dr (Triangle Family Practice),5854,35.9163107,-78.931996,"5, 805",0,1
Riddle Rd at Triangle Day Care,5857,35.95137,-78.89937,"12, 12B",0,NA
Chapel Hill Rd at Wa Wa Ave,5858,35.979646,-78.934904,"10, 10A, 10B",0,NA
MLK Pkwy at Lake Cook Dr,5859,35.942065,-78.916912,7,1,1
Roxboro Rd at Channing Ave (SB),5860,36.0318,-78.89087,4,0,NA
Front St at Carver St (Carver Terrace Apts),5861,36.036232,-78.938973,1,0,0
Cornwallis Rd at Bainbridge Dr (NB),5862,35.93994,-78.896922,"12, 12B",0,NA
University Dr at Hill St,5864,35.985515,-78.910318,7,0,1
Chapel Hill Rd at McGehee St (SB),5865,35.980865,-78.934583,"10, 10A, 10B",0,NA
Hinson Dr at Glenbrook Dr (NB),5866,36.028598,-78.878889,"9, 9A, 9B",0,NA
Fayetteville St at Utah Ave (SB),5867,35.965544,-78.905724,"5, 5K",0,1
Club Blvd at Cascadilla St,5868,36.020002,-78.886482,"9, 9A, 9B",0,NA
Broad St at F St (NC School of Science and Math),5869,36.018429,-78.919169,"1, 1A, 1B",1,1
Holloway St at Herbert St (EB),5870,35.9916,-78.86453,"3B, 3C, 23",0,0
Tower Blvd at Conifer Glen Ln,5871,35.972609,-78.957782,10B,0,NA
Hillsborough Rd at Hilton Durham (EB),5874,36.02548,-78.95765,11,0,NA
Ross Rd at Melbourne St,5876,35.99258,-78.8534,"3B, 23",0,NA
S Roxboro St at Umstead St (SB),5877,35.982575,-78.903331,"7, 8",0,0
Club Blvd at Glenbrook Dr,5880,36.023854,-78.876399,"9, 9A, 9B",0,NA
NC 54 at Fayetteville Rd (Homestead Market),5881,35.910922,-78.936739,"5, 14",0,NA
Holloway St at Adams St,5882,35.98893,-78.85252,3C,0,NA
Mangum St at W Seminary Ave,5883,35.998961,-78.897459,"9, 9A, 9B",0,NA
Chapel Hill St at Brewster St,5884,35.996732,-78.919163,"6, 6B",0,NA
Holloway St at Rochelle St,5887,35.98817,-78.84932,3C,1,0
Sima Ave at Building 18,5892,35.977291,-78.887383,8,0,NA
Roxboro Rd at Old Oxford Rd (SB),5896,36.03512,-78.89275,4,0,NA
Club Blvd at Dollar Ave (Northgate Mall),5897,36.016827,-78.910102,"1, 1A, 1B",1,1
Holloway St at N Driver St (WB),5898,35.994476,-78.878297,"3, 3B, 3C",0,NA
Briggs Ave at Person St (NB),5899,35.969283,-78.877145,8,1,1
Chapel Hill St at Kent St (EB),5900,35.9966706,-78.916957,"6, 6B",1,1
Chapel Hill Rd at Anderson St,5904,35.981954,-78.933386,"10, 10A, 10B",0,NA
Garrett Rd at Eno River Church,5906,35.952195,-78.970986,"10, 10A",0,NA
Fayetteville St at Piedmont Ave (NB),5907,35.98352,-78.89882,"5, 5K",0,NA
Chapel Hill Rd at House St,5908,35.99033,-78.92395,"10, 10A, 10B",0,NA
Chapel Hill Rd at Colonial Apts (SB),5909,35.970417,-78.938818,"10, 10A, 10B",0,NA
Angier Ave at Ellis Rd,5910,35.97297,-78.8668,"2, 2A",0,NA
Fayetteville Rd at Obie Dr (NB),5911,35.926332,-78.923325,5,0,NA
Morehead Ave at Carroll St (EB),5914,35.991715,-78.916333,"10, 10A, 10B",1,1
Hillsborough Rd at Operations Dr (WB),5915,36.0337,-78.968504,11,0,NA
University Dr at Mossdale Ave,5918,35.967701,-78.941843,"10, 10A, 10B",0,NA
Hardee St at Mimosa St (NB),5920,36.001542,-78.866645,3,0,0
Holloway St at Southerland St,5921,35.99078,-78.86062,"3B, 3C, 23",0,NA
Main St at S Blacknall St,5922,35.98652,-78.886,"2, 2A, 2B",0,NA
James St at Nation Ave,5928,35.977255,-78.926258,"10, 10A",0,0
Briggs Ave at Community Gardens,5929,35.9653,-78.879303,8,0,0
Broad St at Sprunt Ave (SB),5930,36.021278,-78.918981,"1, 1A, 1B",0,NA
Fayetteville St at Brant St (NCCU),5931,35.975694,-78.901329,"5, 5K",1,1
Chalk Level Rd at Horton Rd (EB),5932,36.0511808,-78.910598,"9, 9A",0,NA
Riddle Rd at Triangle Day Care,5933,35.951297,-78.90022,"12, 12B",0,NA
Duke St at Jackson St,5934,35.995202,-78.908724,"7, 12, 12B, 15, 700",0,NA
S Roxboro St at Erie St (SB),5938,35.978418,-78.906686,"7, 8",0,NA
Otis St at Nelson St,5939,35.97325,-78.905,7,0,NA
Hardee St at Benning St (SB),5940,36.003223,-78.86718,"2B, 3, 23",1,0
Green St at Broad St,5941,36.011794,-78.919254,11,0,1
Roxboro St at Mallard Ave,5942,35.997705,-78.894992,"9, 9A, 9B",0,NA
University Dr at Weymouth St,5943,35.96713,-78.94822,"10, 10A, 10B",0,NA
Freeman Rd at Obsidian Way (Southern HS),5944,35.997104,-78.825341,"3B, 23",0,NA
Roxboro Rd at Berwyn Ave,5945,36.0343,-78.89153,4,0,NA
Cornwallis Rd at Rogers Herr School,5946,35.97407,-78.93567,"10, 10A",0,NA
E Weaver St at Cornwallis Rd,5947,35.962847,-78.916025,7,0,NA
Enterprise St at Scout Dr,5948,35.983737,-78.904744,7,0,0
Dearborn Dr at Deer Run,5949,36.031599,-78.870344,"9, 9A, 9B",0,NA
Buchanan Blvd at Markham Ave (NB),5951,36.0096164,-78.912347,11,0,1
Chapel Hill St at Duke St (Durham Police Dept),5952,35.996903,-78.909033,"1, 1A, 1B, 6, 6B, 11, 400, 405",0,1
Dowd St at Hazel St (WB),5954,36.000459,-78.888702,"9, 9A, 9B",0,NA
The Streets at Southpoint,5956,35.90513,-78.946474,"5, 14, 800, 800S",Yx2,1
Duke University Rd at Chapel Hill Rd,5957,35.996628,-78.92073,"6, 6B",1,NA
Gary St at N Miami Blvd (NB),5960,35.99211,-78.869367,"2B, 23",0,NA
Buchanan Blvd at Trinity Ave (SB),5962,36.005766,-78.912457,11,0,NA
Roxboro Rd at Maynard Ave (NB),5964,36.02707,-78.889746,4,0,NA
Green St at Berkeley St (WB),5965,36.011652,-78.91573,11,0,1
Chapel Hill Rd at Vesson Ave,5966,35.983018,-78.930887,"10, 10A, 10B",0,NA
Markham Ave at Iredell St,5967,36.009958,-78.921242,11,0,1
Glenbrook St at Club Blvd (SB),5968,36.024384,-78.877255,"9, 9A, 9B",0,NA
Fayetteville Rd at Cook Rd (SB),5970,35.92917,-78.919856,5,0,NA
University Dr at Myra St (WB),5971,35.9665,-78.95292,"10, 10A, 10B",0,NA
Carver St at Charlotte St,5972,36.037715,-78.934167,"1, 1A, 1B",0,NA
NC 55 at Meridian Pkwy,5973,35.9102936,-78.892919,"12, 12B",0,NA
Buchanan Blvd at Gloria Ave (NB),5974,36.003373,-78.912423,11,0,1
Miami Blvd at Robinhood Rd,5977,36.000821,-78.875526,"2B, 23",0,0
Emerald Pond Ln at Pickett Rd,5979,35.97532,-78.96993,10B,1,NA
University Dr at Martin Luther King Jr Pkwy (WB),5980,35.963085,-78.960194,"10, 10A, 400",1,1
N Alston Ave at Geer St (SB),5981,36.003172,-78.886093,"9, 9A, 9B",0,NA
Duke University Rd at Swift Ave (WB),5982,35.997328,-78.924603,"6, 6B",0,NA
Duke St at Kinder Care,5983,36.042654,-78.905756,"4, 9, 9A",0,NA
NC 55 at Dakota St,5984,35.967234,-78.895287,"12, 12B",0,NA
Mangum St at Markham Ave,5985,36.008015,-78.893528,4,0,NA
Otis St at Cecil St,5987,35.97208,-78.90627,7,0,NA
Roxboro St at Gray St,5988,35.999005,-78.894099,"9, 9A, 9B",0,NA
Avondale Dr at Trinity Ave (SB),5989,36.006855,-78.885575,"9, 9A, 9B",0,0
Durham-Chapel Hill Blvd at Car Wash,5990,35.97408,-78.93042,"10, 10A",0,NA
Lynn Rd at Holloway St,5991,35.98652,-78.84353,"3C, 23",0,NA
E Club Blvd at Cascadilla St,5992,36.019858,-78.88636,"9, 9A, 9B",0,NA
Duke St at Trinity Ave,5993,36.00497,-78.90555,"1, 1A, 1B",0,NA
Green St at Berkeley St (EB),5995,36.011557,-78.915981,11,0,1
Meriwether Dr at Old Oxford Rd,5996,36.035929,-78.889875,"9, 9A, 9B",0,NA
Hillsborough Rd at Hilton Durham (WB),5997,36.02485,-78.95708,11,0,NA
Chapel Hill Rd at W Cornwallis Rd,5999,35.97543,-78.93652,"10, 10A, 10B",0,NA
NC 54 at Pine Glen Trail (WB),6000,35.9073197,-78.922869,"14, 800, 805",1,1
Roxboro Rd at Bon Air Ave,6003,36.028286,-78.889972,4,0,NA
NC 55 at Crete St,6004,35.959794,-78.893333,"12, 12B",0,NA
Ben Franklin Blvd at Danube Ln (EB),6005,36.047712,-78.889843,9B,0,1
Buchanan Blvd at Green St,6006,36.0113411,-78.912148,11,0,1
Service Rd at Hillandale Rd (EB),6007,36.0164994,-78.93665,11,0,NA
Angier Ave at Beldon Dr,6008,35.94652,-78.83895,"2, 2A",0,NA
Erwin Rd at Fulton St (Duke University Hospital),6012,36.008087,-78.937774,"6, 6B, 20, 400, 405, BCC, D H5",1,1
Roxboro St at Holloway St,6014,35.99632,-78.8962,"9, 9A, 9B",1,NA
Lawson St at Bacon St (WB),6016,35.97435,-78.884612,8,0,NA
Hillsborough Rd at Lawndale Ave (Food Lion),6018,36.014123,-78.933193,11,1,1
Otis St at Pilot St,6020,35.969541,-78.910683,7,0,NA
Fayetteville St at Lawson St (NCCU),6023,35.9771,-78.900667,"5, 5K",1,1
LaSalle St at Duke Manor Apts (Inbound),6024,36.0152631,-78.946997,11,0,NA
Cornwallis Rd at Beechwood Ave,6026,35.960998,-78.914996,7,0,0
Dowd St at Alston Ave (EB),6031,36.000356,-78.886682,"9, 9A, 9B",0,NA
Fayetteville St at Cecil St (NB),6032,35.97103,-78.901186,"5, 5K",0,1
University Dr at Martin Luther King Jr Pkwy (EB),6036,35.962671,-78.960307,"10, 10A, 10B, 400",1,1
E Main St at Goley St (EB),6039,35.985963,-78.884518,"2, 2A, 2B",0,NA
Hillsborough Rd at Trent Dr (EB),6040,36.011796,-78.93026,11,0,NA
American Dr at White Pine Dr,6042,36.016519,-78.96679,6,0,0
LaSalle St at Blue Crest Ln (Blue Crest Apts),6045,36.013763,-78.948249,"11, D LL",1,NA
Green St at Buchanan Blvd,6047,36.011418,-78.91239,11,0,1
Dearborn Dr at Ora St,6048,36.029329,-78.87017,"9, 9A, 9B",0,NA
Service Rd at Hillandale Rd (WB),6049,36.0167732,-78.936882,11,0,NA
Pickett Rd at Colony Rd,6050,35.975403,-78.964025,10B,0,NA
Lawson St at Ridgeway Ave,6052,35.973721,-78.887892,8,1,NA
Lawson St at S Briggs Ave (Durham Exchange Club),6053,35.974354,-78.87704,8,1,1
Cornwallis Rd at Spring Ridge Apt,6054,35.93817,-78.8951,"12, 12B",0,NA
Green St at Clarendon St (WB),6055,36.011747,-78.91814,11,0,1
Chapel Hill Rd at Huron St,6057,35.981986,-78.932409,"10, 10A, 10B",0,NA
Lawson St at S Briggs Ave (Ferguson),6058,35.974223,-78.877328,8,0,1
Chapel Hill Rd at Chesterfield Apts,6059,35.990191,-78.924186,"10, 10A, 10B",0,NA
Bennett Memorial Rd at Gentry Dr (WB),6060,36.0312096,-78.979047,"6B, 11",0,NA
Ross Rd at Fernando St,6061,35.9924,-78.84257,"3B, 23",0,NA
E Main St at Alston Ave (EB),6063,35.98756,-78.888283,"2, 2A, 2B",0,1
Roxboro Rd at Omega Rd,6064,36.07557,-78.9095,9B,0,NA
Crutchfield St at Pendergrass St,6065,36.03897,-78.90478,"4, 9, 9A",0,NA
Olympic Ave at Roxboro Rd,6067,36.036822,-78.897146,"4, 9, 9A",0,NA
Erwin Rd at Downing St (WB),6068,36.008863,-78.943709,"6, 6B, 11, 400, 405",Yx2,1
Chapel Hill St at Carroll St,6069,35.99687,-78.91558,"6, 6B",0,1
Morehead Ave at Fairview St,6071,35.991874,-78.917911,"10, 10A, 10B",0,0
Gary St at N Miami Blvd (SB),6073,35.992292,-78.869468,"2B, 23",0,NA
Douglas St at Pratt St,6076,36.01117,-78.94275,6,0,NA
Fayetteville St at Eagle Campus Dr,6077,35.97352,-78.900919,"5, 5K",1,NA
Mordecai St at Holston St,6078,36.00417,-78.9555,6,0,NA
Chapel Hill St at Arnette Ave (WB),6079,35.9969316,-78.914077,"6, 6B",0,1
Angier Ave at E Main St (Hosiery Mills),6085,35.989321,-78.892003,BCC,0,1
E Main St at Hyde Park Ave (EB),6086,35.98532,-78.88195,"2, 2A, 2B",0,NA
US 70 at Miami Blvd,6087,35.94837,-78.83663,"2, 2A",0,NA
Angier Ave at E Main St (WB),6088,35.989392,-78.891881,"2, 2A, 2B",1,1
Hardee St at Cheek Rd (SB),6092,36.004544,-78.867021,"2B, 3, 23",1,0
Miami Blvd at Holloway St,6093,35.99337,-78.8699,"2B, 3, 3B, 3C, 23",1,NA
Duke Regional Hospital (SB),6095,36.038147,-78.899033,"9, 9A",1,1
Roxboro Rd at Higbee St,6096,36.01662,-78.89012,4,0,NA
NC 55 at Corona St,6097,35.961685,-78.894217,"12, 12B",0,NA
Riddle Rd at Ancroft Ave,6098,35.95272,-78.897066,"12, 12B",0,NA
Fulton St at Erwin Rd (Duke Hospital Parking Garage),6104,36.008773,-78.937102,"6, 11, DRX, ODX, D H2, D H6",1,1
Guess Rd at Hillcrest Dr,6105,36.02425,-78.91972,1B,0,NA
Guess Rd at Lamar St,6106,36.02685,-78.92308,1B,0,NA
Guess Rd at North Pointe Dr (NB),6107,36.029968,-78.926933,"1A, 1B",0,NA
North Pointe Dr at North Pointe Shopping Center (EB),6109,36.02893,-78.921299,1A,1,1
North Pointe Dr at Broad St (EB),6110,36.028016,-78.91508,1A,1,1
Guess Rd at Lamar St (SB),6114,36.026669,-78.923042,"1, 1B",0,1
Guess Rd at Hillcrest Dr,6115,36.024448,-78.920269,"1, 1B",0,NA
North Pointe Dr at Woodmont Dr,6116,36.03087,-78.92688,"1, 1A",0,NA
Horton Rd at Duke St,6125,36.051277,-78.90699,"9, 9A",0,1
Chalk Level Rd at Horton Rd (Westbound),6126,36.0512776,-78.911004,"9, 9A",0,NA
Stadium Dr at Wyldewood Rd (Foxfire Apts),6128,36.053469,-78.919688,9A,0,NA
New Castle Rd at Wyldewood Rd (SB),6129,36.05138,-78.92357,9A,0,NA
Lawson St at Bacon St (EB),6130,35.974105,-78.885177,8,0,NA
Briggs Ave at Person St (SB 2),6132,35.963091,-78.877635,8,0,1
Briggs Ave at Riddle Rd,6133,35.9588,-78.8792,8,0,NA
Capps St at S Alston Ave,6136,35.962295,-78.886911,8,0,NA
Capps St at Bacon St,6137,35.965196,-78.88354,8,0,NA
Hearthside St at Bacon St,6138,35.9664135,-78.882231,8,0,NA
Hearthside St at Welch Pl,6139,35.967593,-78.883525,8,0,NA
Fayetteville St at Tralea Dr (SB),6142,35.95593,-78.907567,"5, 5K, 7",0,NA
Pickett Rd at Western Bypass Rd,6145,35.97373,-78.95925,10B,0,NA
Fayetteville St at Pilot St (NB),6146,35.963849,-78.907069,"5, 5K",1,1
Fayetteville St at Cornwallis Rd (NB),6147,35.960317,-78.910241,"5, 5K",0,NA
Fayetteville Rd at Dunhill Dr (Pine Ridge Center),6153,35.9162891,-78.931658,"5, 14, 0805",0,1
Roxboro St at Cornwallis Rd,6154,35.965529,-78.918751,7,0,NA
Roxboro Rd at Crutchfield St (Duke Regional Hospital),6155,36.038368,-78.898424,"4, 9, 9A",0,NA
Carver St at Meriwether Dr,6156,36.043206,-78.891931,"9, 9A",0,NA
Club Blvd at Lindbergh St,6157,36.023083,-78.878771,"9, 9A, 9B",0,NA
Dowd St at Gurley St (WB),6158,36.000394,-78.891915,"9, 9A, 9B",0,NA
Dowd St at Gurley St (EB),6159,36.000316,-78.891527,"9, 9A, 9B",0,NA
Dowd St at Hazel St (EB),6160,36.000336,-78.888906,"9, 9A, 9B",0,NA
Dowd St at Alston Ave (WB),6161,36.000449,-78.88648,"9, 9A, 9B",0,NA
Duke St at Cobb St,6162,35.98903,-78.908858,7,0,NA
Chapel Hill Rd at Yates Church,6163,35.97405,-78.93693,"10, 10A, 10B",0,NA
University Dr at Shannon Rd,6164,35.966229,-78.954307,"10, 10A",0,NA
Old Chapel Hill Rd at Garrett Rd (WB),6165,35.949879,-78.96766,"10, 10A, 400",0,1
Chapel Hill Rd at Colonial Apts (NB),6167,35.9704917,-78.938627,"10, 10A, 10B",0,NA
Buchanan Blvd at Minerva Ave,6168,36.00442,-78.91237,11,0,NA
LaSalle St at Duke Manor Apts (NB),6169,36.0152375,-78.946814,"11, D LL",0,NA
Hillsborough Rd at Sparger Rd (Food Lion),6170,36.03292,-78.97917,"6B, 11",0,NA
Lawson St at NCCU Track (EB),6171,35.976159,-78.896717,8,0,NA
Hardee St at Holloway St,6172,35.99245,-78.865885,"3B, 3C",0,NA
Holloway St at Southerland St,6173,35.990587,-78.860324,"3B, 3C, 23",0,NA
E Main St at Driver St (WB),6176,35.985903,-78.877454,"2B, 23",0,NA
Lawson St at Sima Ave (WB),6177,35.974569,-78.890915,8,0,1
Morgan St at Mangum St,6182,35.99747,-78.89833,4,0,NA
Shannon Rd at Auto Dr (Sams Club),6191,35.967547,-78.95519,10B,0,1
Fayetteville Rd at Turmeric Ln,6193,35.937202,-78.907995,5,0,NA
University Dr at Myra St (EB),6196,35.966524,-78.951709,"10, 10A, 10B",0,NA
